{
  "formatVersion": "1.0",
  "programId": "apple-beta-chronology-gap",
  "generatedAt": "2026-07-31T06:37:42.659Z",
  "safety": {
    "sanityMutationAllowed": false,
    "publicationAuthorized": false,
    "stableEventIdCreationAllowed": false,
    "note": "Research packet only. Validation does not authorize Sanity writes, stable IDs, page work, publication, or deployment."
  },
  "summary": {
    "proposedCandidateCount": 40,
    "notProposedCount": 3,
    "byStatus": {
      "needsEvidenceReview": 40
    },
    "byPlatform": {
      "macOS": 40
    },
    "importantQualification": "Forty displayed appearances are confirmed absent from production. Three dated false identities are structured as not-proposed records; two additional undated missing-ordinal findings for macOS 15.6 remain audit findings because no appearance date may be inferred."
  },
  "cohorts": [
    {
      "cohortId": "macos-point-15-26",
      "description": "macOS 15.1–15.6 and 26.1–26.6 point-cycle public-beta chronology.",
      "candidateCount": 40,
      "sourcePaths": [
        "research-handoffs/beta-chronology-gap/macos-point-15-26/assignment.json",
        "research-handoffs/beta-chronology-gap/macos-point-15-26/sources.json",
        "research-handoffs/beta-chronology-gap/macos-point-15-26/raw-evidence-locks.json",
        "research-handoffs/beta-chronology-gap/macos-point-15-26/production-snapshot.json",
        "research-handoffs/beta-chronology-gap/macos-point-15-26/conflicts.json",
        "research-handoffs/beta-chronology-gap/macos-point-15-26/full-sequence-audit.json"
      ],
      "supersessionRule": "Supersede an identity only with captured platform-specific evidence, a fresh exact production reconciliation, and independent chronology review."
    }
  ],
  "candidates": [
    {
      "candidateId": "candidate:apple:macos:15.1:public-beta-1",
      "originCohortId": "macos-point-15-26",
      "platform": "macOS",
      "platformId": "platform-macos",
      "version": "15.1",
      "releaseVersionId": "version-macos-15-1",
      "proposedIdentity": {
        "label": "Public Beta 1",
        "routeAlias": "public-beta-1",
        "channel": "publicBeta",
        "appearanceDate": "2024-09-19",
        "sequence": 1,
        "isRevision": false,
        "availabilityState": "available",
        "closesReleaseCycle": false
      },
      "ordinalBasis": "explicit",
      "candidateStatus": "needsEvidenceReview",
      "identityStatus": "confirmed",
      "evidenceState": "corroborated",
      "productionReconciliation": {
        "status": "confirmedMissing",
        "queriedAt": "2026-07-31T06:37:42.659Z",
        "matchBasis": "Fresh published no-CDN query found zero matches on releaseVersionId, publicBeta channel, routeAlias, label, sequence, and appearanceDate; the exact parent releaseVersion exists.",
        "exactIdentityMatches": 0
      },
      "evidenceRefs": [
        {
          "kind": "packetSource",
          "packetPath": "research-handoffs/beta-chronology-gap/macos-point-15-26/sources.json",
          "sourceId": "9to5-151-cycle",
          "locator": "Use the source-specific supportNote and retained raw-page locator in sources.json; apply all conflicts.json qualifications.",
          "supports": "9to5Mac evidence for macOS 15.1 Public Beta 1's public availability, displayed ordinal, and/or Pacific appearance date."
        },
        {
          "kind": "packetSource",
          "packetPath": "research-handoffs/beta-chronology-gap/macos-point-15-26/sources.json",
          "sourceId": "iculture-151-cycle",
          "locator": "Use the source-specific supportNote and retained raw-page locator in sources.json; apply all conflicts.json qualifications.",
          "supports": "iCulture evidence for macOS 15.1 Public Beta 1's public availability, displayed ordinal, and/or Pacific appearance date."
        }
      ],
      "buildEvidenceStatus": "absent",
      "contentDisposition": "timelineOnly",
      "blockers": [
        "Independent chronology review is pending."
      ],
      "review": {
        "required": true,
        "reviewer": null,
        "reviewedAt": null,
        "notes": "A reviewer independent of the researcher must inspect the platform, audience, displayed public ordinal, Pacific date, source independence, skips, and conflicts."
      },
      "flags": {
        "sanityMutationAllowed": false,
        "publicationEligible": false
      }
    },
    {
      "candidateId": "candidate:apple:macos:15.1:public-beta-2",
      "originCohortId": "macos-point-15-26",
      "platform": "macOS",
      "platformId": "platform-macos",
      "version": "15.1",
      "releaseVersionId": "version-macos-15-1",
      "proposedIdentity": {
        "label": "Public Beta 2",
        "routeAlias": "public-beta-2",
        "channel": "publicBeta",
        "appearanceDate": "2024-09-24",
        "sequence": 2,
        "isRevision": false,
        "availabilityState": "available",
        "closesReleaseCycle": false
      },
      "ordinalBasis": "explicit",
      "candidateStatus": "needsEvidenceReview",
      "identityStatus": "confirmed",
      "evidenceState": "corroborated",
      "productionReconciliation": {
        "status": "confirmedMissing",
        "queriedAt": "2026-07-31T06:37:42.659Z",
        "matchBasis": "Fresh published no-CDN query found zero matches on releaseVersionId, publicBeta channel, routeAlias, label, sequence, and appearanceDate; the exact parent releaseVersion exists.",
        "exactIdentityMatches": 0
      },
      "evidenceRefs": [
        {
          "kind": "packetSource",
          "packetPath": "research-handoffs/beta-chronology-gap/macos-point-15-26/sources.json",
          "sourceId": "9to5-151-cycle",
          "locator": "Use the source-specific supportNote and retained raw-page locator in sources.json; apply all conflicts.json qualifications.",
          "supports": "9to5Mac evidence for macOS 15.1 Public Beta 2's public availability, displayed ordinal, and/or Pacific appearance date."
        },
        {
          "kind": "packetSource",
          "packetPath": "research-handoffs/beta-chronology-gap/macos-point-15-26/sources.json",
          "sourceId": "iculture-151-cycle",
          "locator": "Use the source-specific supportNote and retained raw-page locator in sources.json; apply all conflicts.json qualifications.",
          "supports": "iCulture evidence for macOS 15.1 Public Beta 2's public availability, displayed ordinal, and/or Pacific appearance date."
        }
      ],
      "buildEvidenceStatus": "absent",
      "contentDisposition": "timelineOnly",
      "blockers": [
        "Independent chronology review is pending."
      ],
      "review": {
        "required": true,
        "reviewer": null,
        "reviewedAt": null,
        "notes": "A reviewer independent of the researcher must inspect the platform, audience, displayed public ordinal, Pacific date, source independence, skips, and conflicts."
      },
      "flags": {
        "sanityMutationAllowed": false,
        "publicationEligible": false
      }
    },
    {
      "candidateId": "candidate:apple:macos:15.1:public-beta-3",
      "originCohortId": "macos-point-15-26",
      "platform": "macOS",
      "platformId": "platform-macos",
      "version": "15.1",
      "releaseVersionId": "version-macos-15-1",
      "proposedIdentity": {
        "label": "Public Beta 3",
        "routeAlias": "public-beta-3",
        "channel": "publicBeta",
        "appearanceDate": "2024-10-07",
        "sequence": 3,
        "isRevision": false,
        "availabilityState": "available",
        "closesReleaseCycle": false
      },
      "ordinalBasis": "explicit",
      "candidateStatus": "needsEvidenceReview",
      "identityStatus": "conflict",
      "evidenceState": "corroborated",
      "productionReconciliation": {
        "status": "confirmedMissing",
        "queriedAt": "2026-07-31T06:37:42.659Z",
        "matchBasis": "Fresh published no-CDN query found zero matches on releaseVersionId, publicBeta channel, routeAlias, label, sequence, and appearanceDate; the exact parent releaseVersion exists.",
        "exactIdentityMatches": 0
      },
      "evidenceRefs": [
        {
          "kind": "packetSource",
          "packetPath": "research-handoffs/beta-chronology-gap/macos-point-15-26/sources.json",
          "sourceId": "9to5-151-cycle",
          "locator": "Use the source-specific supportNote and retained raw-page locator in sources.json; apply all conflicts.json qualifications.",
          "supports": "9to5Mac evidence for macOS 15.1 Public Beta 3's public availability, displayed ordinal, and/or Pacific appearance date."
        },
        {
          "kind": "packetSource",
          "packetPath": "research-handoffs/beta-chronology-gap/macos-point-15-26/sources.json",
          "sourceId": "mr-151-pb3-update",
          "locator": "Use the source-specific supportNote and retained raw-page locator in sources.json; apply all conflicts.json qualifications.",
          "supports": "MacRumors evidence for macOS 15.1 Public Beta 3's public availability, displayed ordinal, and/or Pacific appearance date."
        },
        {
          "kind": "packetSource",
          "packetPath": "research-handoffs/beta-chronology-gap/macos-point-15-26/sources.json",
          "sourceId": "iculture-151-cycle",
          "locator": "Use the source-specific supportNote and retained raw-page locator in sources.json; apply all conflicts.json qualifications.",
          "supports": "iCulture evidence for macOS 15.1 Public Beta 3's public availability, displayed ordinal, and/or Pacific appearance date."
        }
      ],
      "buildEvidenceStatus": "absent",
      "contentDisposition": "timelineOnly",
      "blockers": [
        "Independent review must adjudicate iCulture's October 8 row against two October 7 Pacific reports; only 9to5Mac independently supplies the displayed Public Beta 3 ordinal.",